book_id,book_title,author,genre,year,synopsis
7,One Hundred Years of Solitude,Gabriel García Márquez,Fiction,1967,"A multi-generational story of the Buendía family in the town of Macondo."
8,Crime and Punishment,Fyodor Dostoevsky,Classic,1866,"A psychological drama about crime, guilt, and redemption."
14,The Book Thief,Markus Zusak,Historical Fiction,2005,"A young girl's life in Nazi Germany, narrated by Death."
17,"Thinking, Fast and Slow",Daniel Kahneman,Nonfiction,2011,"Explores the two systems that drive the way we think."
22,Animal Farm,George Orwell,Satire,1945,"A satirical allegory of Soviet totalitarianism."
